{
  "protocol_version": "agent.v1",
  "interaction_id": "interaction_1",
  "kind": "choice",
  "mode": "one_tap",
  "status": "pending",
  "title": "Choose a plan",
  "prompt": "Select the plan to continue with.",
  "options": [
    {
      "id": "safe",
      "label": "Safe",
      "description": "Prefer reversibility.",
      "metadata": {}
    },
    {
      "id": "fast",
      "label": "Fast",
      "description": "Prefer speed.",
      "metadata": {}
    }
  ],
  "response_schema": {
    "type": "object",
    "required": ["option_id"]
  },
  "payload": {},
  "metadata": { "allow_custom": false },
  "resume": {
    "kind": "chat_turn",
    "token": "turn_1"
  },
  "created_at": "2026-07-23T10:00:00Z"
}
